{
  "$schema": "../../schemas/boldcreate.schema.json",
  "phase": 2,
  "wave": "A",
  "transport": "streamable-http",
  "auth": "header",
  "alternativeAuth": [
    "oauth"
  ],
  "hostedBy": "vendor",
  "docs": "https://developers.google.com/maps/ai/grounding-lite",
  "stage": "ga",
  "endpointCheck": {
    "lastLiveCheck": null,
    "source": "vendor docs (docs.cloud.google.com/mcp/supported-products)"
  }
}
