{
  "$schema": "../../schemas/boldcreate.schema.json",
  "phase": 1,
  "wave": "A",
  "transport": "streamable-http",
  "auth": "none",
  "alternativeAuth": [],
  "hostedBy": "vendor",
  "docs": "https://awslabs.github.io/mcp/servers/aws-knowledge-mcp-server",
  "endpointCheck": {
    "lastLiveCheck": "2026-10-24",
    "source": "live initialize call"
  }
}
