{
  "$schema": "../../schemas/boldcreate.schema.json",
  "phase": 1,
  "wave": "A",
  "transport": "streamable-http",
  "auth": "none",
  "alternativeAuth": [],
  "hostedBy": "vendor",
  "docs": "https://docs.devin.ai/work-with-devin/deepwiki-mcp",
  "endpointCheck": {
    "lastLiveCheck": null,
    "source": "vendor docs"
  }
}
