{
  "$schema": "../../schemas/boldcreate.schema.json",
  "phase": 2,
  "wave": "B",
  "transport": "streamable-http",
  "auth": "oauth",
  "alternativeAuth": [],
  "hostedBy": "vendor",
  "docs": "https://docs.cloud.google.com/compute/docs/use-compute-engine-mcp",
  "stage": "ga",
  "oauthScopes": [
    "https://www.googleapis.com/auth/cloud-platform"
  ],
  "endpointCheck": {
    "lastLiveCheck": null,
    "source": "vendor docs (docs.cloud.google.com/mcp/supported-products)"
  }
}
