{
  "$schema": "../../schemas/boldcreate.schema.json",
  "phase": 2,
  "wave": "B",
  "transport": "streamable-http",
  "auth": "oauth",
  "alternativeAuth": [],
  "hostedBy": "vendor",
  "docs": "https://developers.google.com/workspace/guides/configure-mcp-servers",
  "stage": "preview",
  "oauthScopes": [
    "https://www.googleapis.com/auth/directory.readonly",
    "https://www.googleapis.com/auth/userinfo.profile",
    "https://www.googleapis.com/auth/contacts.readonly"
  ],
  "endpointCheck": {
    "lastLiveCheck": null,
    "source": "vendor docs (developers.google.com/workspace/guides/configure-mcp-servers)"
  }
}
