{
  "$schema": "../../schemas/boldcreate.schema.json",
  "phase": 1,
  "wave": "B",
  "transport": "streamable-http",
  "auth": "oauth",
  "alternativeAuth": [],
  "hostedBy": "vendor",
  "docs": "https://vercel.com/docs/agent-resources/vercel-mcp",
  "endpointCheck": {
    "lastLiveCheck": null,
    "source": "vendor docs"
  }
}
