{
  "$schema": "../../schemas/boldcreate.schema.json",
  "phase": 2,
  "wave": "B",
  "transport": "streamable-http",
  "auth": "oauth",
  "alternativeAuth": [
    "bearer"
  ],
  "hostedBy": "vendor",
  "docs": "https://docs.gitlab.com/user/model_context_protocol/mcp_server/",
  "stage": "ga",
  "endpointCheck": {
    "lastLiveCheck": null,
    "source": "vendor docs"
  }
}
