{
  "$schema": "../../schemas/boldcreate.schema.json",
  "phase": 1,
  "wave": "A",
  "transport": "streamable-http",
  "auth": "oauth",
  "alternativeAuth": [
    "bearer"
  ],
  "hostedBy": "vendor",
  "docs": "https://context7.com/docs/resources/all-clients",
  "endpointCheck": {
    "lastLiveCheck": null,
    "source": "vendor docs"
  }
}
