{
  "$schema": "../../schemas/boldcreate.schema.json",
  "phase": 2,
  "wave": "A",
  "transport": "streamable-http",
  "auth": "header",
  "alternativeAuth": [],
  "hostedBy": "vendor",
  "docs": "https://stitch.withgoogle.com/docs/mcp/setup/",
  "stage": "beta",
  "endpointCheck": {
    "lastLiveCheck": null,
    "source": "vendor docs (docs.cloud.google.com/mcp/supported-products)"
  }
}
