{
  "$schema": "../../schemas/boldcreate.schema.json",
  "phase": 1,
  "wave": "A",
  "transport": "streamable-http",
  "auth": "oauth",
  "alternativeAuth": [
    "bearer"
  ],
  "hostedBy": "vendor",
  "docs": "https://github.com/neondatabase-labs/mcp-server-neon",
  "endpointCheck": {
    "lastLiveCheck": null,
    "source": "vendor docs"
  }
}
